{
  "run_id": "type-declaration-path-basic-token-single-001",
  "repo": "type-declaration-path-basic",
  "task": "在不改变运行时行为的前提下，让 npm test 通过。",
  "agent_report": {
    "status": "passed",
    "changed_files": [
      "package.json"
    ],
    "runtime_files_changed": false,
    "test_files_changed": false,
    "dependency_changed": false,
    "commands_run": [
      {
        "command": "npm test",
        "status": "passed",
        "summary": "Initial npm test failed because package.json types pointed to missing ./dist/index.d.ts. Updated types to ./index.d.ts. Final npm test passed: node scripts/check-types-entry.js && node --test; ok 1 - labels a value; # pass 1; # fail 0."
      }
    ],
    "verification": {
      "passed": [
        "Final npm test exited 0.",
        "Type declaration entry now points to existing ./index.d.ts.",
        "Runtime code, tests, and dependency lock files were not modified."
      ],
      "failed": []
    },
    "risk": {
      "level": "low",
      "score": 1,
      "reasons": [
        "Only package.json type declaration metadata changed.",
        "No runtime behavior changed.",
        "Full requested verification passed."
      ],
      "remaining_risks": []
    }
  },
  "runner_metrics": {
    "model": null,
    "input_tokens": 71724,
    "output_tokens": 962,
    "total_tokens": 72686,
    "tool_calls": 1,
    "duration_seconds": 144.7491493
  }
}
