{
  "run_id": "type-export-default-basic-token-single-001",
  "repo": "type-export-default-basic",
  "task": "在不改变运行时行为的前提下，让 npm test 通过。",
  "agent_report": {
    "status": "passed",
    "changed_files": [
      "package.json"
    ],
    "runtime_files_changed": false,
    "test_files_changed": false,
    "dependency_changed": false,
    "commands_run": [
      {
        "command": "npm test",
        "status": "passed",
        "summary": "Initial npm test failed because exports.default pointed to missing runtime file ./dist/index.js. Updated package.json exports.default to ./index.js. Final npm test passed: ok 1 - labels a value; # pass 1; # fail 0."
      }
    ],
    "verification": {
      "passed": [
        "final npm test exited 0",
        "node scripts/check-export-default.js passed",
        "node --test passed with 1 passing test and 0 failures"
      ],
      "failed": []
    },
    "risk": {
      "level": "low",
      "score": 1,
      "reasons": [
        "Only package export configuration changed",
        "No runtime files, tests, dependencies, or lockfiles changed",
        "Full requested verification passed"
      ],
      "remaining_risks": []
    }
  },
  "runner_metrics": {
    "model": null,
    "input_tokens": 72286,
    "output_tokens": 1185,
    "total_tokens": 73471,
    "tool_calls": 1,
    "duration_seconds": 161.2229386
  }
}
