{
  "run_id": "lint-var-basic-token-single-001",
  "repo": "lint-var-basic",
  "task": "让 npm test 通过；只允许最小范围 lint/格式修复，不要修改测试或依赖。",
  "agent_report": {
    "status": "passed",
    "changed_files": [
      "index.js"
    ],
    "runtime_files_changed": true,
    "test_files_changed": false,
    "dependency_changed": false,
    "commands_run": [
      {
        "command": "npm test",
        "status": "passed",
        "summary": "Initial npm test failed lint with: lint-var-basic: use const instead of var in index.js. After changing var to const in index.js, npm test passed: ok 1 - normalizes input; # pass 1; # fail 0."
      }
    ],
    "verification": {
      "passed": [
        "final_exit=0",
        "npm test passed",
        "lint passed",
        "node --test passed: 1 test passed"
      ],
      "failed": []
    },
    "risk": {
      "level": "low",
      "score": 2,
      "reasons": [
        "Minimal lint-only change in index.js from var to const.",
        "No tests, dependencies, lock files, or lint scripts were modified."
      ],
      "remaining_risks": []
    }
  },
  "runner_metrics": {
    "model": null,
    "input_tokens": 71050,
    "output_tokens": 848,
    "total_tokens": 71898,
    "tool_calls": 1,
    "duration_seconds": 197.7705457
  }
}
