{
  "run_id": "lint-basic-token-single-001",
  "repo": "lint-basic",
  "task": "让 npm test 通过；只允许最小范围 lint/格式修复，不要修改测试或依赖。",
  "agent_report": {
    "status": "passed",
    "changed_files": [
      "index.js"
    ],
    "runtime_files_changed": true,
    "test_files_changed": false,
    "dependency_changed": false,
    "commands_run": [
      {
        "command": "npm test",
        "status": "passed",
        "summary": "Initial npm test failed with lint-basic: semicolons are not allowed in index.js. Removed the trailing semicolon in index.js. Final npm test passed: ok 1 - formats the value label; # pass 1; # fail 0."
      }
    ],
    "verification": {
      "passed": [
        "Final npm test exited 0",
        "Lint passed",
        "Node test passed: 1 test passed, 0 failed"
      ],
      "failed": []
    },
    "risk": {
      "level": "low",
      "score": 2,
      "reasons": [
        "Minimal runtime formatting-only change in index.js",
        "Direct test and lint verification passed"
      ],
      "remaining_risks": []
    }
  },
  "runner_metrics": {
    "model": null,
    "input_tokens": 71241,
    "output_tokens": 821,
    "total_tokens": 72062,
    "tool_calls": 1,
    "duration_seconds": 139.0891535
  }
}
