{
  "run_id": "dependency-tooling-basic-token-single-001",
  "repo": "dependency-tooling-basic",
  "task": "让 npm test 通过；只允许最小范围 package/tooling 配置修复，不要修改运行时代码、测试或依赖锁文件。",
  "agent_report": {
    "status": "passed",
    "changed_files": [
      "package.json"
    ],
    "runtime_files_changed": false,
    "test_files_changed": false,
    "dependency_changed": true,
    "commands_run": [
      {
        "command": "npm test",
        "status": "failed",
        "summary": "Initial npm test failed with dependency config error: expected @mvp/local-runner to use file:./vendor/mvp-local-runner, got file:./vendor/missing-runner."
      },
      {
        "command": "npm test",
        "status": "passed",
        "summary": "Final npm test passed: node scripts/check-dependency-config.js && node --test; ok 1 - normalizes names; # pass 1; # fail 0."
      }
    ],
    "verification": {
      "passed": [
        "Final npm test exited 0.",
        "Dependency config now points @mvp/local-runner to file:./vendor/mvp-local-runner."
      ],
      "failed": []
    },
    "risk": {
      "level": "low",
      "score": 1,
      "reasons": [
        "Only package.json dependency file path configuration changed.",
        "No runtime files, tests, lockfiles, or check scripts changed.",
        "Full requested verification passed."
      ],
      "remaining_risks": []
    }
  },
  "runner_metrics": {
    "model": null,
    "input_tokens": 71555,
    "output_tokens": 1277,
    "total_tokens": 72832,
    "tool_calls": 1,
    "duration_seconds": 151.075266
  }
}
